id,user,text,timestamp,in_reply_to,mentioned_users,reactions,total_reactions
1599600360.012700,U0172CTQ3A5,"Re: Startup websites. Simplify and make it clear. Check out  the “StoryBrand” Template (Great book, “Building a StoryBrand” by Donald Miller.

I’ve attached the template here, but your site needs to pass the “Grunt Test” - In 3 seconds, are there clear answers to these questions:
- What do you sell?
- How does it make my life better?
- How do I buy?

Another fun resource is <https://saaspages.xyz>.","Mon, 19 Jan 1970 12:20:00 GMT",1599600360.012700,,,0
1599602979.013300,U0169FVV2LF,<@U016DN2FYQ7> <@U016T0QSCMT> ,"Mon, 19 Jan 1970 12:20:02 GMT",1599600360.012700,"U016DN2FYQ7,U016T0QSCMT",,0
1599242925.010300,U0172CTQ3A5,Good thread re: fundraising for you guys when you’re going down that path - <https://twitter.com/melt_dem/status/1301691684078727171?s=21|https://twitter.com/melt_dem/status/1301691684078727171?s=21>,"Mon, 19 Jan 1970 12:14:02 GMT",,,"[{""name"":""fire"",""users"":[""U017DN0DZ08"",""U016PNPMFSN"",""U0169FVV2LF"",""U01733WAA1F"",""U017G0TNCFN"",""U017GN6FHQA"",""U0172G1A28H"",""U016H5ETT6J"",""U016X212QMA"",""U017EF8VBS4"",""U016M08G1M4""],""count"":11}]",11
1598980534.008200,U016SKSLW9G,<@U016C909613> Oliver wrote probably the best sentence I’ve ever encountered about a hummingbird: “Who doesn’t want to live with the brisk motor of his heart singing?”,"Mon, 19 Jan 1970 12:09:40 GMT",,U016C909613,"[{""name"":""heart"",""users"":[""U016C909613"",""U0172CM3049"",""U016C8XH6NR"",""U017EF8VBS4"",""U0172G1A28H""],""count"":5}]",5
1598965699.006400,U016C909613,"after the last keynote, <@U016SKSLW9G> mentioned he was glad to see Mary Oliver in the syllabus for Module 7 — that she was ‘one of the true geniuses’.

i agree with thomas. at the heart of all the ‘big picture sacred economics’ is a spirit of joy. amongst all the work to be done this week for me (or for you to build out a pitch deck, or raise funding, or anything), mary reminds us of the importance of joy, moment to moment. it helped me a lot this morning and i hope it helps you :slightly_smiling_face:

<https://structureandstyle.org/post/71905788555/dont-hesitate>","Mon, 19 Jan 1970 12:09:25 GMT",,U016SKSLW9G,"[{""name"":""heart"",""users"":[""U01733WAA1F"",""U016C8XH6NR"",""U017G0TNCFN"",""U0172CM3049"",""U016PNPMFSN"",""U017E2A2KPS"",""U01693HHP9V"",""U017EF8VBS4""],""count"":8}]",8
1598893098.002000,U0172CTQ3A5,"If anyone is in the LA Area, we’re still running “CryptoMonday” meetups. In Santa Monica - outside in a park, with masks so fairly COVID-friendly - come by if you’re in the area! <https://www.meetup.com/Crypto-Mondays-L-A/events/xqmwwrybclbpc/>","Mon, 19 Jan 1970 12:08:13 GMT",,,"[{""name"":""party_parrot"",""users"":[""U017DN0DZ08"",""U0172CB3649"",""U017G0TNCFN"",""U016C8XH6NR""],""count"":4},{""name"":""raised_hands"",""users"":[""U016QSTSQQM"",""U0172CB3649"",""U017G0TNCFN"",""U016Z7XQC7N"",""U016C8XH6NR""],""count"":5}]",9
1598887384.000600,U0172CM3049,"_“I’ve heard that all good advice converges towards what can fit into a fortune cookie. So here’s my contribution: Always start by working your way back to your north star—what change do you want to bring to yourself and the world?_
_Then, try to take a few steps towards that north star that you think are valuable to the world, and do them really well. Then, try to make it sustainable so you can keep doing that.”_
_—_ Buster Benson","Mon, 19 Jan 1970 12:08:07 GMT",,,"[{""name"":""100"",""users"":[""U017E2A2KPS"",""U017EF8VBS4""],""count"":2}]",2
1598652745.059300,U016PNPMFSN,<https://www.youtube.com/watch?v=DVvmgjBL74w&amp;feature=youtu.be> live now! the future!,"Mon, 19 Jan 1970 12:04:12 GMT",1598652745.059300,,,0
1598674232.060800,U0172CM3049,Why does it remind me of Black mirror :confounded:,"Mon, 19 Jan 1970 12:04:34 GMT",1598652745.059300,,,0
1598680455.063600,U016PNPMFSN,<https://waitbutwhy.com/2017/04/neuralink.html> this may help you be more optimistic about it :slightly_smiling_face:,"Mon, 19 Jan 1970 12:04:40 GMT",1598652745.059300,,"[{""name"":""raised_hands"",""users"":[""U0172CM3049""],""count"":1}]",1
1598640880.058900,U0172CTQ3A5,Good read: <https://blog.bitmex.com/dreams-of-a-peasant/>,"Mon, 19 Jan 1970 12:04:00 GMT",,,"[{""name"":""fire"",""users"":[""U017DN0DZ08""],""count"":1}]",1
1598500198.046600,U017GN6FHQA,This would make an interesting module for web3 programs/fellowships,"Mon, 19 Jan 1970 12:01:40 GMT",1598500198.046600,,"[{""name"":""heavy_plus_sign"",""users"":[""U0172CM3049"",""U01733WAA1F"",""U016C8XH6NR"",""U016M08G1M4"",""U016C909613"",""U016PNPMFSN"",""U017G0TNCFN"",""U017E2A2KPS""],""count"":8},{""name"":""heart"",""users"":[""U01733WAA1F"",""U016C8XH6NR"",""U016M08G1M4"",""U017G0TNCFN"",""U017E2A2KPS""],""count"":5},{""name"":""heavy_check_mark"",""users"":[""U017E2A2KPS"",""U0172G1A28H""],""count"":2},{""name"":""seedling"",""users"":[""U017E2A2KPS""],""count"":1}]",16
1598501736.047200,U01733WAA1F,kernel.community should be part of their syllabus!,"Mon, 19 Jan 1970 12:01:41 GMT",1598500198.046600,,"[{""name"":""heart"",""users"":[""U016C8XH6NR"",""U0172CM3049"",""U016PNPMFSN"",""U0169FVV2LF"",""U017E2A2KPS""],""count"":5},{""name"":""seedling"",""users"":[""U016C8XH6NR"",""U017E2A2KPS""],""count"":2}]",7
1598514220.048200,U0172CB3649,LOL,"Mon, 19 Jan 1970 12:01:54 GMT",1598500198.046600,,,0
1598526441.048600,U016M08G1M4,that should be the only thing in their syllabus,"Mon, 19 Jan 1970 12:02:06 GMT",1598500198.046600,,"[{""name"":""grin"",""users"":[""U0172CB3649"",""U017E2A2KPS""],""count"":2}]",2
1598662239.059600,U017E2A2KPS,<@U017GN6FHQA> we actually do this in our business and technology department. In their entrepreneurship class their is an entire module on building things people don't need and in their design thinking  class there is a module focussed on tech with purpose.  It's been very beneficial and we've seen it reflected in their portfolio projects. It's a shame they're only teenagers but we encourage them to keep building as they move into university. As they are global leaders in the making we think it's necessary. :gem:,"Mon, 19 Jan 1970 12:04:22 GMT",1598500198.046600,U017GN6FHQA,"[{""name"":""heart"",""users"":[""U017GN6FHQA""],""count"":1}]",1
1598677648.063100,U017GN6FHQA,"Thats great! There's actually a podcast called ""should we build this"" hosted by catherina fake, i dont think they release new episodes anymore :( but theres not enough discussions around this topic imo","Mon, 19 Jan 1970 12:04:37 GMT",1598500198.046600,,"[{""name"":""heavy_check_mark"",""users"":[""U017E2A2KPS""],""count"":1}]",1
1598678001.063400,U017E2A2KPS,"<@U017GN6FHQA> I tend to agree, there is not enough challenging discourse on this in the tech space. Beyond tech, however it is very topical.","Mon, 19 Jan 1970 12:04:38 GMT",1598500198.046600,U017GN6FHQA,,0
1598442376.044700,U0172CB3649,"This last KERNEL module was very dense and stimulating and brought me back to some old topics of research/reflection.
Here I share some references/suggestions that came to my mind.

`On the *performativity of language*` as introduced in <https://kernel.community/module-5/incentives/#persuasion|module 5> (“What constitutes persuasive language? Words which perform what they say.“) and `the *inertia of language*` that hides our unconscious internalisation of old paradigms (or, better, the ideologies that substantiate them), topic of <https://kernel.community/module-7/no-paradigm/|module 7> I would like to make a connection with the work of the famous French sociologist, *Pierre Bourdieu* (1930 – 2002) which elaborated the very influential theory of _<https://en.wikipedia.org/wiki/Pierre_Bourdieu#Theory_of_habitus|habitus>_<https://en.wikipedia.org/wiki/Pierre_Bourdieu#Theory_of_habitus| and its >_<https://en.wikipedia.org/wiki/Pierre_Bourdieu#Theory_of_habitus|embodiment>_, <https://en.wikipedia.org/wiki/Pierre_Bourdieu#Symbolic_capital|symbolic capital> and finally <https://en.wikipedia.org/wiki/Symbolic_violence#Language|symbolic violence>.
In Bourdieu’s idea relations of domination in society are _reinforced through_ symbolic media, such as _language_, where even the ‘oppressed’ groups _unconsciously_ reiterate their status quo of their subordination with the use of the language of the dominants. This happens because of the _performative nature of speech acts_. I remember <@U016Q117G67> stressing very nicely this point of *the importance of using an appropriate language* in one of the KERNEL Fireside (now I can’t recall which one of them).

I cite (to amplify) <https://kernel.community/module-7/no-paradigm/|this passage> that I really liked from this final module:

_*Our history can be seen as the retroactive telling of various paradigmatic stories*;_
&gt; _their inception, flourishing, and collapse; and how there always has been a new paradigm waiting to substitute for the collapsed one. These stories do not, however, sufficiently emphasize a recurrent and ubiquitous phenomenon [...] This phenomenon is best described as *the inertia of language*._
_This inertia is both a symptom of paradigmatic stories, and *the dynamic force behind their telling*. It can be traced through facts like how the sun still “rises”, even though we have known that it is the Earth’s horizon which dips into dawn, and rises into darkness._
&gt; _Due to this inertia, language stores and offers for communicative usage many remnants of many obsolete paradigms._
_*If we accept these remnants in what we write, speak or hear, then we subject ourselves* to the unstoppable inertia behind it. This is something for which we must take individual responsibility:_
&gt; _In human society language is so powerful that only violence can stop it. Where its power fails to serve my desires, it would be a mistake to blame such failure on the weakness of language. Rather *I should blame the weakness of my relation to language*. If I fail to notice that I think and speak, under the influence of language, *in patterns and constructs accumulated and preserved* in the junkyards of long since vanished paradigms, then this shows my lack of consciousness with regard to just *that power with which language can quickly make me spokesman for ideologies*, in which everybody is almost always “right” at the “wrong” time._
Connected to the “power of language”  here a nice *TED talk by* cognitive scientist *Lera Boroditsky* who conducts studies on _<https://www.ted.com/talks/lera_boroditsky_how_language_shapes_the_way_we_think?language=en|How language shapes the way we think>_ (and, I would say the other way around too, how we can see through the cultural differences across language semantics how words embody specific cultural beliefs and and way of representing the world).

Finally, still in relationship to performative speech and also *`horizontal conversations`*, I would like to propose a concept in philosophy of language and in particular of pragmatic theory, the <https://en.wikipedia.org/wiki/Cooperative_principle|cooperative principle> mainly represented by *Paul Grice*’s <https://www.sas.upenn.edu/~haroldfs/dravling/grice.html|four Maxims on Conversation>:
1. *The maxim of quantity* (_Don’t give more information or less than needed_)
2. *The maxim of quality (*_Try to make your contribution one that is true)_
3. *The maxim of relation (*_Be relevant)_
4. *The maxim of manner* (_Avoid ambiguity, obscurity of expression and unnecessary prolixity_)
I think those maxims are fundamental for the ethics in a conversation that wants to be peer-to-peer, transparent and positive-sum where “<https://kernel.community/module-0/conversation/|Participants share trust, living within the same context>”.","Mon, 19 Jan 1970 12:00:42 GMT",1598442376.044700,,"[{""name"":""heart"",""users"":[""U016C8XH6NR"",""U0172CM3049"",""U016C909613"",""U016Q1J7Y83"",""U017G0TNCFN"",""U016Z7XQC7N""],""count"":6},{""name"":""sparkles"",""users"":[""U0172CM3049"",""U016C909613"",""U017G0TNCFN""],""count"":3},{""name"":""seedling"",""users"":[""U01691XLMD5""],""count"":1}]",10
1598529780.053800,U016C909613,"bianca i can’t tell you how interesting and helpful this post has been. so happy i read it prior to the talk with Vitalik, it illuminates the module in ways i otherwise would not have seen 

specifically, there is an open question on how we use this new “language” (one which blends money and speech) to reframe our society consciously at a time when it is so clearly needed. 

your post contains reminders on how to build a horizontal convo with vitalik, as well as how to ensure we spend time *unlearning* together today as well as learning together. ","Mon, 19 Jan 1970 12:02:09 GMT",1598442376.044700,,"[{""name"":""seedling"",""users"":[""U0172CB3649"",""U01691XLMD5""],""count"":2},{""name"":""relaxed"",""users"":[""U0172CB3649""],""count"":1}]",3
1598529822.055200,U016C909613,"cc <@U016Q1J7Y83> for today 

and cc <@U016C8XH6NR> for the type of post we need to save on Circle! or maybe a discourse :face_with_monocle:","Mon, 19 Jan 1970 12:02:09 GMT",1598442376.044700,"U016Q1J7Y83,U016C8XH6NR","[{""name"":""sparkles"",""users"":[""U0172CB3649"",""U016C8XH6NR"",""U016Q1J7Y83""],""count"":3},{""name"":""heart"",""users"":[""U016C8XH6NR"",""U016Q1J7Y83""],""count"":2}]",5
1598538858.056400,U0172CB3649,"Thanks a lot <@U016C909613>! I really appreciate you taking your time to read it and I’m very happy that it was useful to you/Kernel.
This conjunction of money and speech is definitely key and I can’t agree more on how you synthesised the point <@U016Q117G67> made in this module session: _*unlearning*_ old bad constructs to learn new ways together…","Mon, 19 Jan 1970 12:02:18 GMT",1598442376.044700,"U016C909613,U016Q117G67",,0
1598431830.031700,U0172CB3649,That’s beautiful <@U0172CM3049>!,"Mon, 19 Jan 1970 12:00:31 GMT",,U0172CM3049,"[{""name"":""hugging_face"",""users"":[""U0172CM3049"",""U017E2A2KPS""],""count"":2}]",2
1598428715.030900,U0172CM3049,"Just about half way through this week’s modules and it has deeply moved me. All the little links that point to absolute gems on the internet. During one of the conversations with Apollo applicants, someone mentioned why he liked the trust module: “it’s less focussed on building upon something you know and more focussed on questioning the foundations of your being, and getting to the reasons of developing what you’re developing” — I feel that to be so true.

Came across this other little post today by Kent Beck (brilliant programmer) on his realisations and personal mission in life, for anyone interested: <https://www.facebook.com/notes/kent-beck/my-personal-mission/1811782322187957/>

“_There are ways my mission began the day I walked out of my first college CS course grumbling, “I’m going to change how people do this.” However, the whole picture only came into focus after decades of detailed work. That’s what I’d recommend to you if you’re beginning your career (you know, the first decade or two). Instead of coming up with high-falutin’ words, write more programs._
_Once you have enough puzzle pieces, then you can arrange and rearrange them and see what picture pops up_.”","Mon, 19 Jan 1970 12:00:28 GMT",,,"[{""name"":""heart"",""users"":[""U01733WAA1F"",""U017DN0DZ08"",""U0172CB3649"",""U016C8XH6NR"",""U016PP38YLA"",""U017E2A2KPS"",""U016PNPMFSN""],""count"":7},{""name"":""seedling"",""users"":[""U016C8XH6NR"",""U017E2A2KPS""],""count"":2}]",9
1598372884.024500,U016M08G1M4,"For anyone who wants to join the $NAZ fam on Telegram: <https://t.me/nazbondsurf|https://t.me/nazbondsurf>

I will explore Status for this","Mon, 19 Jan 1970 11:59:32 GMT",1598372884.024500,,,0
1598372934.024700,U016M08G1M4,Wrong link. DM me your telegram username and I'll invite you to the channel where you can talk,"Mon, 19 Jan 1970 11:59:32 GMT",1598372884.024500,,,0
1598349063.012000,U0172MSC92A,Hey! I have been working on a tshirt/sweater designs together with <@U016M08G1M4> and <@U016Q1J7Y83> This is the (maybe) final version. Let us know what you think! File in the comments bellow.,"Mon, 19 Jan 1970 11:59:09 GMT",1598349063.012000,"U016M08G1M4,U016Q1J7Y83",,0
1598350972.012400,U016PP38YLA,can you upload it again? I can't see/download it,"Mon, 19 Jan 1970 11:59:10 GMT",1598349063.012000,,,0
1595839150.290100,U016HTJ5Q4W,"How about the whole ethereum community switch from twitter to some more decentralized social network?
reason: <https://www.evanvanness.com/post/624463633751195648/twitter-incompetence-in-one-small-image> and I believe you know many more similar stories.

<https://www.reuters.com/article/us-twitter-cyber-access-exclusive/exclusive-more-than-1000-people-at-twitter-had-ability-to-aid-hack-of-accounts-idUSKCN24O34E>
&gt; More than a thousand Twitter employees and contractors as of earlier this year had access to internal tools that could change user account settings and hand control to others
Also: bZx was hacked -&gt; no one is touching it anymore, twitter was hacked -&gt; no one cares and everybody keeps twitting, what is wrong with us? :slightly_smiling_face:

Do you know any alternatives? I suggest <https://mastodon.online/about>","Mon, 19 Jan 1970 11:17:19 GMT",1595839150.290100,,,0
1595840989.290600,U016BTBS3MM,"I'm a big on decentralization, but I'd like to point out that this particular problem likely won't go away if there would be a decentralized Twitter clone.
I write a little thread about this here: <https://twitter.com/William94029369/status/1283669135696830464>","Mon, 19 Jan 1970 11:17:20 GMT",1595839150.290100,,,0
1595841063.290900,U016BTBS3MM,"In short, if the platform has a suspension mechanism, then it can most likely be gamed without the ability for a centralized authority to set things straight afterwards. If there is no suspension mechanism, it will most likely turn in to a toxic wasteland that makes Chernobyl look hospitable.","Mon, 19 Jan 1970 11:17:21 GMT",1595839150.290100,,,0
1595842074.291100,U016ZPHMHL4,"Something like peepeth on an L2 would be interesting. but I think the peepeth name leaves a lot to be desired.

Interesting points <@U016BTBS3MM>. Maybe decentralised blocks/unblocks would help here? In this example I’m sure enough of us could vouch for Evan and - as a community - agree to reinstate him (or rather, we never would have blocked him :D). Sounds like a job for kleros?","Mon, 19 Jan 1970 11:17:22 GMT",1595839150.290100,U016BTBS3MM,,0
1595842829.291300,U016BTBS3MM,"Perhaps. It would have to mitigate Sybil attacks, since otherwise someone sufficiently mitigated could mobilize their bot army to block/report. I don't know enough about Kleros to comment about their process, but my fear with any decentralized jury is that it likely has all the possible attacks of meatspace juries (collusion, bribery, marketing of law through spin PR, etc.) in addition to adding cyberspace vulnerabilities (bugs, hacks, etc.).","Mon, 19 Jan 1970 11:17:22 GMT",1595839150.290100,,,0
1595849938.291900,U016HTJ5Q4W,"my point was that we don't trust anyone with private key to our wallet but we trust 1000 Twitter employees with our social reputation, and now after one of the biggest web2 hacks everybody is like nothing serious happened, we keep doing the same. isn't that hypocrisy?","Mon, 19 Jan 1970 11:17:29 GMT",1595839150.290100,,,0
1595851023.292100,U016HTJ5Q4W,"from the other side, twitter alternative doesn't have to be decentralized and on a blockchain, it's enough it is encrypted and secure. but I see that in this case, the value that platform provides (number of followers) can outweigh any inconveniencies","Mon, 19 Jan 1970 11:17:31 GMT",1595839150.290100,,,0
1595851076.292300,U016BTBS3MM,"I've heard people use the hypocrisy argument, and I don't totally agree. I suspect most of us have bank accounts and credit cards, in which we trust centralized authorities with our very monetary existence. I don't see this as a contradiction to 'not your keys, not your crypto'. We should bake decentralization into everything we're building whenever we can, totally agreed. I don't think it means we need to abandon everything else, especially without comparable alternatives.
The point I was really making, though, is that while I am all for making a decentralized Twitter, it will most likely not solve this problem, or will need to cope with a toxicity issue. I'd prefer the latter, frankly. We can make filters.","Mon, 19 Jan 1970 11:17:31 GMT",1595839150.290100,,,0
1595851153.292500,U016BTBS3MM,"I think your second point is very close to the point I was making. Depending on which problem set you focus on, decentralization might not be the answer. I'm not far from being a censorship-resistance maximalist, so I'm for decentralizing all the things, but you have to understand what you're enabling if you do that.","Mon, 19 Jan 1970 11:17:31 GMT",1595839150.290100,,,0
1595681332.280800,U016KTNL5QW,one of the better explanations of YFI <https://youtu.be/3IkRHymMWLM>,"Mon, 19 Jan 1970 11:14:41 GMT",,,"[{""name"":""raised_hands"",""users"":[""U016PUK3G9Z"",""U016WSQKPCL"",""U016A43FT0F"",""U016Q117G67"",""U016HL16614"",""U017G0TNCFN"",""U017DN0DZ08"",""U017E885WBA"",""U016PP38YLA"",""U0172G1A28H""],""count"":10}]",10
1595648544.277800,U016C909613,happy birthday to our very own <@U017HFE51EU> 🥳🥳🥳,"Mon, 19 Jan 1970 11:14:08 GMT",,U017HFE51EU,"[{""name"":""rainbow"",""users"":[""U016C8XH6NR"",""U016KTNL5QW"",""U017E2A2KPS"",""U016PUK3G9Z"",""U016Q1J7Y83"",""U016AMDF215"",""U016M08G1M4"",""U01733WAA1F"",""U017G0TNCFN"",""U016H5ETT6J"",""U017DN0DZ08"",""U0169JV8C95""],""count"":12},{""name"":""birthday"",""users"":[""U016A43FT0F"",""U016KTNL5QW"",""U017E2A2KPS"",""U016Q1J7Y83"",""U01753XEZTK"",""U01692CEFQF"",""U0172G1A28H"",""U0172CM3049"",""U01691XLMD5"",""U016AMDF215"",""U016M08G1M4"",""U01733WAA1F"",""U017G0TNCFN"",""U016PEM9U5B"",""U016H5ETT6J"",""U017DN0DZ08"",""U016PP38YLA"",""U016Q01RH5H""],""count"":18},{""name"":""balloon"",""users"":[""U016A43FT0F"",""U016HAELGES"",""U016KTNL5QW"",""U017E2A2KPS"",""U016Q1J7Y83"",""U01691XLMD5"",""U016AMDF215"",""U016M08G1M4"",""U01733WAA1F"",""U017EF8VBS4"",""U017G0TNCFN"",""U016H5ETT6J"",""U017DN0DZ08""],""count"":13}]",43
1595644150.277200,U017E2A2KPS,Nice. :headphones:,"Mon, 19 Jan 1970 11:14:04 GMT",,,,0
1595623029.267900,U017DKW89DW,dope,"Mon, 19 Jan 1970 11:13:43 GMT",,,,0
1595623024.267700,U01748SCQ81,nice,"Mon, 19 Jan 1970 11:13:43 GMT",,,,0
1595623010.267400,U01692CEFQF,"Hey <!channel>!

Tonight I'm gonna do a live techno DJ set on mixcloud, if anyone's interested feel free to drop by in the link below:

<https://www.mixcloud.com/live/Artphaser/>

Starting in 5 min :slightly_smiling_face:

Thanks","Mon, 19 Jan 1970 11:13:43 GMT",1595623010.267400,,"[{""name"":""satellite"",""users"":[""U016PEM9U5B"",""U016PNPMFSN"",""U016Q1J7Y83"",""U017GN6FHQA"",""U016HFP7P2A"",""U017E2A2KPS"",""U016C909613"",""U0172CM3049""],""count"":8}]",8
1595667295.279600,U01692CEFQF,"For anyone who wasn't able to listen to the live, I will re-upload the mix and a couple of others to my page @artphaser :wink:","Mon, 19 Jan 1970 11:14:27 GMT",1595623010.267400,,,0
1595673131.280000,U0172G1A28H,waiting,"Mon, 19 Jan 1970 11:14:33 GMT",1595623010.267400,,,0
1595708102.282700,U017J0ESE48,mannn u should have told u beforee!!!,"Mon, 19 Jan 1970 11:15:08 GMT",1595623010.267400,,,0
1595752891.284000,U01692CEFQF,"There you go everyone :slightly_smiling_face: I will add the tracklist when I am able to

 <https://www.mixcloud.com/Artphaser/phase-3-phuture-technocracy/>

Next time I'll say something in advance.

I have create a <#C0183QR9UAV|music> channel, feel free to join :slightly_smiling_face:","Mon, 19 Jan 1970 11:15:52 GMT",1595623010.267400,,,0
1595779593.285000,U017J0ESE48,sweet!,"Mon, 19 Jan 1970 11:16:19 GMT",1595623010.267400,,,0
1595606476.265000,U016Q1J7Y83,"(Anyone with a fear of water, look away)","Mon, 19 Jan 1970 11:13:26 GMT",,,,0
1595606450.264400,U016Q1J7Y83,<https://twitter.com/sim_pop/status/1286690368549986304?s=21|https://twitter.com/sim_pop/status/1286690368549986304?s=21>,"Mon, 19 Jan 1970 11:13:26 GMT",,,"[{""name"":""joy"",""users"":[""U016AMDF215"",""U016KTNL5QW""],""count"":2}]",2
1595584829.262000,U016M08G1M4,if anyone is interested,"Mon, 19 Jan 1970 11:13:04 GMT",,,,0
1595584824.261800,U016M08G1M4,talking about my market making bot with Wildcards,"Mon, 19 Jan 1970 11:13:04 GMT",,,,0
1595584816.261500,U016M08G1M4,<https://youtu.be/-dIWWgeuRBQ>,"Mon, 19 Jan 1970 11:13:04 GMT",,,,0
1595546233.252500,U016C909613,any basketball fans here? hoops are back up in NYC :basketball::statue_of_liberty:,"Mon, 19 Jan 1970 11:12:26 GMT",1595546233.252500,,"[{""name"":""wave"",""users"":[""U017E885WBA"",""U016X212QMA"",""U016AMDF215"",""U016HPVFV54"",""U017G0TNCFN"",""U016HFP7P2A"",""U017VDU1T17""],""count"":7},{""name"":""fire"",""users"":[""U017E885WBA"",""U016HAELGES"",""U016C8XH6NR"",""U0172CM3049"",""U016X212QMA"",""U016PP38YLA"",""U016AMDF215"",""U01733WAA1F"",""U0169JE8HV5"",""U017G0TNCFN"",""U016HFP7P2A"",""U017VDU1T17""],""count"":12},{""name"":""basketball"",""users"":[""U016Q1J7Y83"",""U016X212QMA"",""U016AMDF215"",""U0169JE8HV5"",""U017G0TNCFN"",""U017VDU1T17""],""count"":6},{""name"":""party_parrot"",""users"":[""U0169JE8HV5"",""U017G0TNCFN"",""U017E885WBA"",""U017VDU1T17""],""count"":4},{""name"":""sparkles"",""users"":[""U0169JE8HV5"",""U017G0TNCFN"",""U017VDU1T17""],""count"":3},{""name"":""100"",""users"":[""U0169JE8HV5"",""U017G0TNCFN"",""U017VDU1T17""],""count"":3}]",35
1595858881.293500,U017VDU1T17,You still owe me a pickup game!,"Mon, 19 Jan 1970 11:17:38 GMT",1595546233.252500,,,0
1595858896.293700,U016C909613,my man,"Mon, 19 Jan 1970 11:17:38 GMT",1595546233.252500,,,0
1595858907.293900,U016C909613,"HORSE anytime, pickup with you is asking for trouble","Mon, 19 Jan 1970 11:17:38 GMT",1595546233.252500,,,0
